row_id,narrative_snippet,distilbert_ACTOR_ans,distilbert_ACTOR_conf,distilbert_SYSTEM_ans,distilbert_SYSTEM_conf,distilbert_PHASE_ans,distilbert_PHASE_conf,distilbert_TRIGGER_ans,distilbert_TRIGGER_conf,distilbert_OUTCOME_ans,distilbert_OUTCOME_conf,roberta_ACTOR_ans,roberta_ACTOR_conf,roberta_SYSTEM_ans,roberta_SYSTEM_conf,roberta_PHASE_ans,roberta_PHASE_conf,roberta_TRIGGER_ans,roberta_TRIGGER_conf,roberta_OUTCOME_ans,roberta_OUTCOME_conf,aerobert_ACTOR_ans,aerobert_ACTOR_conf,aerobert_SYSTEM_ans,aerobert_SYSTEM_conf,aerobert_PHASE_ans,aerobert_PHASE_conf,aerobert_TRIGGER_ans,aerobert_TRIGGER_conf,aerobert_OUTCOME_ans,aerobert_OUTCOME_conf,agreement_roberta_distilbert_f1,agreement_roberta_aerobert_f1
64,GA Flight Instructor reported a near miss at PSM a,GA Flight Instructor,0.6375083923339844,takeoff,0.11882291734218597,training,0.8009197115898132,a near miss,0.5118885636329651,performed a takeoff and turned away from the aircraft immediately then returned for a landing,0.22109748423099518,the Instructor,2.024744844675297e-06,another aircraft,0.000416847673477605,training,0.4118662178516388,near miss,0.08525821566581726,returned for a landing,0.06875799596309662,final while landing on a training,0.0005468823947012424,final while landing on a training,0.0005447248695418239,final while landing on a training,0.0005430100718513131,final while landing on a training,0.0005567846819758415,final while landing on a training,0.0005426318384706974,0.58,0.11666666666666667
65,A Flight Instructor reported they descended to 150,A Flight Instructor,0.7334902854054235,Flight Instructor,0.25196592579595745,Flight,0.36794841289520264,they descended to 150 ft over a populated area,0.279236376285553,they descended to 150 ft over a populated area,0.08635123074054718,Flight Instructor reported they descended to 150 ft over a populated area.,2.6224137172903283e-07,Flight Instructor reported they descended to 150 ft over a populated area.,1.4755278243683279e-06,descended,0.3685801923274994,descended to 150 ft over a populated area,0.0026280703023076057,descended to 150 ft,0.03357864171266556,150 ft over a,0.006771122571080923,150 ft over,0.0063644894398748875,150 ft over,0.006760035175830126,150 ft over,0.006597080733627081,150 ft over,0.006404787302017212,0.4430769230769231,0.4057142857142857
66,ATC TRACON Controller reported the Tower not follo,TRACON Controller,0.6853343844413757,two aircraft,0.2528790235519409,vector two aircraft to maintain separation,0.2384725958108902,the TRACON Controller having to vector two aircraft to maintain separation,0.1051047220826149,vector two aircraft to maintain separation,0.17779378592967987,two aircraft,4.743708359455923e-06,Tower,0.1135617345571518,vector two aircraft to maintain separation,2.0473073163884692e-05,the Tower not following procedures,0.2775675654411316,the TRACON Controller having to vector two aircraft to maintain separation,0.06377863883972168,to,0.0036498227855190635,to,0.0037492754636332393,to,0.003702007932588458,to,0.0037969833938404918,to,0.0037115515442565084,0.35,0.09350649350649351
67,Air carrier Captain reported an airborne conflict ,Air carrier Captain,0.8860458135604858,UAS,0.16151461005210876,airborne,0.3537711501121521,airborne conflict,0.2109343707561493,No evasive action,0.2793235182762146,UAS,0.01735801154791261,UAS,0.016688750438333955,final approach,0.3941367566585541,airborne conflict,0.314536452293396,No evasive action was taken,0.17821796238422394,UAS,0.010683134896680713,UAS,0.010435586562380195,UAS,0.01041258149780333,UAS,0.010726768523454666,UAS,0.011169543722644448,0.55,0.4
68,Air carrier crew reported a traffic conflict with ,Air carrier crew,0.6555055361241102,TCAS,0.44190236646682024,takeoff,0.9007266163825989,traffic conflict,0.4339367151260376,turned on course,0.5915489196777344,a TCAS RA,2.928843287008931e-06,TCAS RA,0.0331728421151638,takeoff,0.6785321831703186,traffic conflict,0.3060242831707001,turned on course,0.8254390954971313,parallel runway. The air carrier crew received,0.0012749395100399852,parallel runway. The air carrier crew received,0.0012698054779320955,parallel runway. The air carrier crew received,0.001306106336414814,parallel runway. The air carrier crew received,0.001278886804357171,parallel runway. The air carrier crew received,0.0013113354798406363,0.7333333333333333,0.0
69,GA pilot reported a near miss with another aircraf,GA pilot,0.8819108009338379,other aircraft flying erratically,0.12793217599391937,final approach,0.9252532720565796,near miss with another aircraft during final approach due to other aircraft flying erratically,0.15936516225337982,final approach,0.6803326606750488,.,9.308427451060197e-08,other aircraft flying erratically,0.0027165599531144835,erratically,0.25935472163837403,other aircraft flying erratically,0.799264132976532,final approach,0.3515942394733429,final approach,0.004168306011706591,final approach,0.0041442266665399075,near miss,0.004036966245621443,near miss,0.004128139931708574,final approach,0.004454122856259346,0.48888888888888893,0.2
70,Air carrier flight crew reported an NMAC on final ,UAS or balloon,0.15354874730110168,UAS or balloon,0.6161385178565979,final approach,0.7574873566627502,No evasive action,0.12194827198982239,No evasive action,0.3679439127445221,balloon. No evasive action was taken.,1.123977085626393e-06,UAS or balloon,0.02090338245034218,final approach,0.6650203466415405,a UAS or balloon,0.2968670129776001,No evasive action was taken,0.1552274525165558,a,0.0028708612080663443,a,0.002718521049246192,a,0.002897110767662525,a,0.002874674741178751,a,0.003007727675139904,0.5944444444444444,0.0
71,Air carrier flight crew reported a GPWS terrain wa,Air carrier flight crew,0.45393016934394836,RNAV Y 24,0.9166185960639268,normal landing,0.5065404176712036,a GPWS terrain warning,0.3445380926132202,a normal landing,0.37176865339279175,Crew executed a go-around and returned for a normal landing.,2.5905961820171797e-07,RNAV Y 24,0.000790592166595161,Air carrier flight crew reported a GPWS terrain warning while intercepting course,0.027836650609970093,GPWS terrain warning,0.2822263836860657,returned for a normal landing,0.21290256083011627,course for RNAV Y 24 at ROA airport,0.0013679607072845101,course for RNAV Y 24 at ROA airport,0.0013616587966680527,course for RNAV Y 24 at ROA airport,0.0014239451847970486,course for RNAV Y 24 at ROA airport,0.0013667085440829396,course for RNAV Y 24 at ROA airport,0.001407564152032137,0.5666666666666667,0.18847687400318977
72,C172 student pilot reported momentary loss of cont,C172 student pilot,0.5754797515692189,landing,0.30065929889678955,landing,0.97524094581604,momentary loss of control,0.35283830761909485,momentary loss of control on landing,0.30417540669441223,.,2.949689985598525e-07,C172,0.4394736886024475,landing,0.8078309297561646,momentary loss of control,0.22008225321769714,momentary loss of control on landing,0.0809454694390297,C172 student pilot reported momentary loss of,0.028666066005825996,C172 student pilot reported momentary loss of,0.02784948330372572,C172 student pilot reported momentary loss of,0.02829916961491108,C172 student pilot reported momentary loss of,0.028371142223477364,C172 student pilot reported momentary loss of,0.029975460842251778,0.6,0.2513986013986014
73,Air Taxi Captain on approach to SAT reported a Tra,Air Taxi Captain,0.7582807540893555,VFR,0.900597291853046,Class C,0.700859010219574,Traffic Alert,0.44846484065055847,avoid an unidentified VFR aircraft outside of the Class C airspace,0.06677861511707306,TCAS/RA,0.013149214908480644,VFR aircraft,0.052033837884664536,Class C,0.6571500897407532,Traffic Alert from ATC followed by a TCAS/RA,0.06494627147912979,a TCAS/RA,0.05727078765630722,VFR aircraft outside of,0.002714812057092786,VFR aircraft outside of,0.00260397931560874,VFR aircraft outside of,0.00267324096057564,VFR aircraft outside of,0.00268256978597492,VFR aircraft outside of,0.0026734824059531093,0.4222222222222222,0.13333333333333333
74,Corporate jet pilot reported a near miss with an a,Corporate jet pilot,0.9281337857246399,TCAS RA,0.388463843613863,descending on final approach,0.38313278555870056,TCAS RA,0.10566211491823196,TCAS RA,0.5216259360313416,TCAS RA.,2.475527196565963e-07,TCAS RA,0.0032483874820172787,final approach,0.3216932415962219,TCAS RA,0.32173746824264526,TCAS RA,0.5282295346260071,final approach,0.0013147792778909206,final approach,0.0013374058762565255,final approach,0.0013485084054991603,final approach,0.0013186999130994081,final approach,0.0013829919043928385,0.7333333333333333,0.2
75,A pilot reported a NMAC while practicing ground re,A pilot,0.5143023133277893,NMAC,0.617768282070756,ground reference maneuvers,0.17220227420330048,a NMAC,0.2827902138233185,NMAC,0.35145819187164307,non-towered private airport.,1.0542488837472774e-07,NMAC,0.035670195138663985,ground reference maneuvers,0.10279137641191483,practicing ground reference maneuvers,0.07891669124364853,NMAC,0.03912776708602905,-towered,0.0049338433891534805,while practicing ground reference maneuvers in the traffic pattern of a non-towered,0.004667398985475302,-towered,0.00467919185757637,-towered,0.004810807760804892,-towered,0.004674214171245694,0.6,0.0
76,Two Flight Instructors reported a near miss with e,Two Flight Instructors,0.9022348912403686,other aircraft landed on the same runway,0.09949243068695068,final approach,0.8275753855705261,a near miss with each other,0.22808970510959625,a go-around,0.1375795155763626,.,1.711290948946953e-07,towered,0.009701323695480824,final approach,0.7658854722976685,near miss with each other,0.03982613980770111,performed a go-around,0.12300436198711395,each other at a non-towered airport. The aircraft on final approach,0.001549248700030148,each other at a non-towered,0.0021210197592154145,each other at a non-towered airport. The aircraft on final approach,0.0015378035604953766,each other at a non-towered airport. The aircraft on final approach,0.0015141491312533617,each other at a non-towered airport. The aircraft on final approach,0.0014546951279044151,0.5333333333333333,0.12987012987012986
77,Helicopter flight instructor reported another heli,Helicopter flight instructor,0.7030382362281671,helicopter,0.7559027075767517,flight instructor reported another helicopter on a converging,0.18370427191257477,NMAC event,0.40070366859436035,a NMAC event,0.2827378511428833,helicopter,1.4043916962691583e-07,helicopter,0.01667845615884289,converging,0.4661290149670094,NMAC event,0.23203077912330627,taking immediate evasive action and a NMAC event,0.27436119318008423,converging,0.013443605974316597,converging,0.013907862827181816,converging,0.013516768114641309,converging,0.013515751343220472,converging,0.014507992891594768,0.638888888888889,0.2
78,NCT TRACON Controller reported SFO departed one ai,NCT TRACON Controller reported SFO,0.2743230467895046,SEGUL Departure,0.37428486347198486,SEGUL Departure,0.6417421698570251,SFO departed one aircraft on the SEGUL Departure,0.14559166133403778,Departure Control,0.21587122976779938,SFO departed one aircraft on the SEGUL Departure,6.346773488985491e-07,SFO departed one aircraft on the SEGUL Departure,0.010805254802107811,Departure,0.33488780085463077,SFO departed one aircraft on the SEGUL Departure,0.049515239894390106,SFO departed one aircraft on the SEGUL Departure,0.08548169583082199,one,0.0011518169194459915,unfeasible,0.0021492476807907224,one,0.0011777357431128621,one,0.0011600409634411335,one,0.0011570979841053486,0.5,0.15
79,Center Controller reported an aircraft that they p,Center Controller,0.48239314556121826,NMAC,0.43566779769025743,NMAC,0.1309310793876648,a NMAC with another aircraft,0.03231075033545494,report a NMAC with another aircraft,0.14402300119400024,another aircraft,9.23448442335939e-06,NMAC with another aircraft,0.003580093616619706,NMAC,0.03333108471997548,NMAC with another aircraft,0.19176800549030304,NMAC with another aircraft,0.10021854192018509,that they provided services to and was sent to UNICOM,0.003867548773996532,that they provided services to and was sent to UNICOM,0.003856247407384217,that they provided services to and was sent to UNICOM,0.003868893487378955,that they provided services to and was sent to UNICOM,0.003967728465795517,that they provided services to and was sent to UNICOM,0.0039247197564691305,0.6577777777777778,0.0
80,Air carrier Captain reported having a near miss wi,Air carrier Captain,0.9533774256706238,hot air balloons,0.4402518719434738,instrument approach,0.22284404933452606,a near miss,0.2273249626159668,prohibiting the operation of hot air balloons around established and active arrival paths,0.11473529785871506,hot air balloons,5.415211489889771e-05,hot air balloons,0.47309041023254395,approach,0.0005172478267922997,hot air balloons,0.7047545909881592,near miss,0.20441223680973053,air balloons that were along the instrument approach,0.002140676137059927,air balloons that were along the instrument approach,0.0020441568922251463,air,0.0024741962552070618,air balloons that were along the instrument approach,0.002092483453452587,air balloons that were along the instrument approach,0.002081080339848995,0.4,0.24000000000000005
81,A student pilot reported they turned base leg behi,student pilot,0.4708654582500458,NMAC,0.7653681372758001,final,0.5512027740478516,a NMAC,0.2724490463733673,NMAC,0.49479115662325057,.,7.012729241751003e-08,wrong aircraft,0.1293751746416092,final,0.8689799904823303,turned base leg behind the wrong aircraft on final resulting in a NMAC,0.08840164542198181,a NMAC,0.4315994381904602,final resulting in a,0.003590153995901346,final resulting in a,0.0036419257521629333,base leg behind the,0.0035985284484922886,final resulting in a,0.0036792538594454527,final resulting in a,0.0037742869462817907,0.4333333333333334,0.08571428571428572
82,GA pilot on short final to a non-towered airport r,GA pilot,0.8374771475791931,final,0.5389673113822937,final,0.6586225032806396,an aircraft turned onto final from a base leg in front of them,0.1684780865907669,NMAC,0.127469003200531,aircraft turned onto final from a base leg in front of them.,4.2153135382250184e-07,non-towered,0.003518391866236925,final,0.6392111638560891,an aircraft turned onto final from a base leg in front of them,0.4406251311302185,an aircraft turned onto final,0.043205972760915756,front of,0.0020800677593797445,front of,0.0020293686538934708,front of,0.0020889579318463802,front of,0.0020249399822205305,front of,0.0020884887780994177,0.4,0.12307692307692308
83,Air carrier First Officer reported on a night visu,Air carrier First Officer,0.8733987212181091,overshooting the final approach course,0.31767481565475464,night visual approach,0.3781164586544037,overshooting the final approach course,0.4734339714050293,overshooting,0.49230363115202636,.,3.1893718244191405e-07,visual approach,0.03123737871646881,night,0.5141454339027405,a night visual approach being high and fast,0.18278366327285767,overshooting the final approach course,0.3884119689464569,overshooting the final approach,0.0023606594186276197,overshooting the final approach,0.002250286634080112,overshooting the final approach,0.0022404900519177318,overshooting the final approach,0.0023402358638122678,overshooting the final approach,0.002317301114089787,0.283030303030303,0.2914285714285715
84,Air carrier flight crew reported an NMAC with a UA,Air carrier flight crew reported an NMAC with a UAS,0.29156988859176636,UAS,0.2607177197933197,approach,0.4526350498199463,No evasive action,0.34593692421913147,No evasive action,0.5542608499526978,a UAS during approach.,3.7452500691870227e-06,UAS,0.13331596553325653,approach,0.8293080925941467,NMAC with a UAS,0.14499244093894958,No evasive action was taken,0.4323955476284027,UAS,0.01066086022183299,UAS,0.01043295138515532,UAS,0.010336445178836584,UAS,0.010710451751947403,UAS,0.011212041601538658,0.5863636363636363,0.4
85,Government UAS pilot reported exceeding authorized,Government UAS pilot,0.6452483534812927,UAS,0.14369389414787292,Government UAS pilot reported exceeding authorized altitude during a flight,0.13661028444766998,exceeding authorized altitude,0.4605853259563446,exceeding authorized altitude,0.27101951837539673,.,8.54152375495687e-08,UAS,0.00018120567835921975,authorized altitude,0.02713005058467388,exceeding authorized altitude,0.7007068395614624,exceeding authorized altitude,0.1970159262418747,UAS,0.027233318891376257,UAS,0.026345554273575544,UAS,0.01877211593091488,UAS,0.02728731418028474,UAS,0.027291445061564445,0.6727272727272726,0.2
86,Pilot reported they descended below their assigned,Low Altitude Alert,0.26727741956710815,they descended below their assigned altitude,0.1261359602212906,Low Altitude,0.7152694463729858,Low Altitude Alert,0.23519881069660187,Low Altitude Alert,0.4853275716304779,ATC.,2.4134114937623963e-06,ATC.,2.4555558866268257e-06,descended below their assigned altitude,0.43286797404289246,descended below their assigned altitude,0.1344422549009323,descended below their assigned altitude,0.2637476623058319,Alert from ATC,0.008298456203192472,Alert from ATC,0.0076844042632728815,Alert from,0.004532914608716965,Alert from ATC,0.008099478669464588,Alert from ATC,0.008144905557855964,0.15714285714285717,0.2
87,Flight Instructor with student reported an NMAC wi,The student pilot,0.39733195304870605,UAS,0.5044988139998168,cruise,0.6494643092155457,an NMAC with a UAS during cruise flight,0.09536010026931763,The student pilot took evasive action to avoid possible collision with the UAS,0.07556141912937164,.,8.023747710694806e-08,UAS,0.04441054165363312,cruise,0.5263670086860657,NMAC with a UAS,0.09370028227567673,NMAC with a UAS,0.027673667296767235,UAS,0.004773849039338529,UAS,0.00480792170856148,UAS,0.004769244464114308,UAS during cruise flight,0.0034436823334544897,UAS,0.004965151194483042,0.5904761904761904,0.35714285714285715
88,A Flight Instructor on short final to a non-towere,A Flight Instructor,0.7185755689279176,NMAC,0.3788890540599823,final,0.5443657636642456,another aircraft turned from base leg to final in front of them,0.09453204274177551,final,0.45505455136299133,aircraft turned from base leg to final in front of them.,1.7905284721564385e-07,non-towered,0.00328330066986382,final,0.32063034432940185,another aircraft turned from base leg to final in front of them,0.5992288589477539,another aircraft turned from base leg to final,0.12149077653884888,front of,0.0022256553638726473,front of,0.002185356803238392,front of,0.0022298889234662056,front of,0.00213359366171062,front of,0.002223656279966235,0.4444444444444445,0.11868131868131868
89,Corporate jet Captain reported being established o,Corporate jet Captain,0.899709165096283,VFR general aviation aircraft that was not in communication with ATC,0.2623424828052521,jet,0.6736772656440735,VFR traffic use this corridor to avoid controlled airspace and terrain,0.04946412518620491,VFR traffic use this corridor to avoid controlled airspace and terrain,0.13420620560646057,VFR general aviation aircraft,0.0015165945515036583,VFR general aviation aircraft,0.18589073419570923,VFR general aviation,0.35151776671409607,VFR traffic use this corridor to avoid controlled airspace and terrain,0.04729955643415451,received a TA,0.011405974626541138,VFR,0.0016045324737206101,VFR general aviation,0.0011449714074842632,VFR general aviation,0.001102525508031249,VFR,0.001089705910999328,VFR,0.0016466036904603243,0.30666666666666664,0.4847619047619047
90,B737 Captain reported pilot flying failed to flare,Captain,0.7762295603752136,failed to flare properly,0.29379507899284363,hard landing,0.5904998779296875,hard landing,0.17298631370067596,hard landing,0.4813908338546753,.,2.258498881246851e-07,pilot flying failed to flare properly,0.1510554850101471,pilot flying,0.5909597873687744,pilot flying failed to flare properly,0.40300655364990234,hard landing,0.5770732760429382,B737 Captain reported pilot flying failed to flare properly which resulted in a,0.01031241100281477,B737 Captain reported pilot flying failed to flare properly which resulted in a,0.010572533123195171,B737 Captain reported pilot flying failed to flare properly which resulted in a,0.010338223539292812,B737 Captain reported pilot flying failed to flare properly which resulted in a,0.010568709578365088,B737 Captain reported pilot flying failed to flare properly which resulted in a,0.010998793877661228,0.36,0.3238095238095238
91,General aviation pilot reported a near miss with a,General aviation pilot,0.5342912524938583,helicopter,0.8590092062950134,night,0.46126434206962585,a near miss,0.24282415211200714,coordinated altitude changes,0.09409919381141663,helicopter,0.003487121546640992,helicopter,0.5340142250061035,night,0.22563406825065613,near miss with a helicopter,0.10615354776382446,altitude changes,0.04260906204581261,General aviation,0.0017014487530104816,the,0.0017841719673015177,the,0.000923112325835973,the,0.0017518962849862874,General aviation,0.0017877760110422969,0.6933333333333334,0.0
92,A C-172M instructor reported descending below mini,a student,0.32924655079841614,C-172M,0.7139076973544434,steep turn,0.3315216898918152,descending below minimum altitude when performing training maneuvers with a student during a steep turn,0.2072938084602356,descending below minimum altitude when performing training maneuvers with a student during a steep turn,0.156387597322464,student during a steep turn.,3.95008754594528e-08,C-172M,0.07739470899105072,training,0.4017782509326935,descending below minimum altitude,0.5221145153045654,descending below minimum altitude,0.27220824360847473,minimum altitude when performing training maneuvers with a student,0.0032448815181851387,minimum altitude when performing training maneuvers with a student,0.0029845540411770344,minimum altitude when performing training maneuvers with a,0.0031405319459736347,minimum altitude when performing training maneuvers with a student,0.003289885353296995,minimum altitude when performing training maneuvers with a student,0.003154120175167918,0.4682352941176471,0.21666666666666665
93,DHC6 Pilot reported observing a MU-2 purposely ove,DHC6 Pilot,0.7829832434654236,MU-2 purposely overflying a C-150,0.27968689799308777,NMAC,0.7038874160498381,a NMAC,0.38263750076293945,NMAC,0.4541020409524208,MU-2,5.216141289565712e-05,MU-2,0.02869820035994053,landed,0.2288283109664917,NMAC,0.15199297666549683,NMAC,0.4538157880306244,overflying,0.007306752493605018,overflying a C-150 that had just,0.005141486879438162,overflying,0.007183215348049998,overflying,0.007377179339528084,overflying,0.00748427351936698,0.48,0.0
94,Fractional First Officer reported entering a VFR p,Fractional First Officer,0.6358814560517203,jet aircraft,0.4189204275608063,VFR pattern altitude appropriate for jet,0.18883854150772095,entering a VFR pattern altitude,0.1258128136396408,the correct altitude was lower,0.33679628372192383,Fractional First Officer,4.3905761231144425e-06,jet aircraft,0.010176826268434525,VFR,0.8594214583863504,the correct altitude was lower,0.03988327085971832,lower,0.544236421585083,for,0.001310771214775741,for jet aircraft; but was informed by ATC that the,0.0008601010777056217,for,0.0013164174160920084,for,0.0013164778356440365,for jet aircraft; but was informed by ATC that the,0.0008623149478808045,0.5871428571428571,0.07272727272727272
95,A Corporate pilot reported descending below their ,Corporate pilot,0.608038604259491,Low Altitude Alert,0.06589440256357193,Low Altitude,0.45767608284950256,A Corporate pilot reported descending below their assigned altitude,0.17407026886940002,Low Altitude Alert,0.5157067775726318,ATC.,1.6712529031792656e-06,ATC.,9.948580554919317e-07,Corporate,0.22171710431575775,descending below their assigned altitude,0.27997416257858276,descending below their assigned altitude,0.18083687126636505,Alert from ATC,0.007118763402104378,Alert from,0.004145663697272539,Alert from,0.004206920508295298,Alert from,0.0040345401503145695,Alert from ATC,0.007299196673557162,0.20384615384615384,0.1
96,ZAU Center Controller and their trainee reported t,ZAU Center Controller,0.7685257792472839,aircraft,0.4722999632358551,Minimum Enroute Altitude,0.3991289734840393,they missed an erroneous altitude read back,0.07190968841314316,the aircraft descended below the Minimum Enroute Altitude,0.3101879358291626,aircraft descended below the Minimum Enroute Altitude.,1.7228114757017465e-07,erroneous altitude read back,0.05166297405958176,descended below the Minimum Enroute Altitude,0.10332179069519043,they missed an erroneous altitude read back,0.11628296971321106,descended below the Minimum Enroute Altitude,0.3987778425216675,erroneous,0.006893364945426583,erroneous,0.0070516911800950766,erroneous,0.007252109004184604,erroneous,0.007114009000360966,erroneous,0.007176029030233622,0.5318181818181819,0.13714285714285715
97,GA Flight Instructor reported while being vectored,GA Flight Instructor,0.6004640460014343,ATC then issuing an immediate climb to avoid a collision with traffic,0.03841673582792282,practice,0.5085521340370178,collision with traffic,0.48985788226127625,immediate climb to avoid a collision with traffic,0.0980345830321312,GA,3.70923930859135e-06,GA Flight Instructor reported while being vectored,3.1244476303982083e-06,practice approach,0.3173636198043823,ATC advised them of traffic,0.20823884010314941,ATC then issuing an immediate climb,0.15457652509212494,practice approach ATC advised them of,0.0014998255064710975,practice approach ATC advised them of,0.0015210071578621864,practice approach ATC advised them of,0.0014343825168907642,practice approach ATC advised them of,0.0015367732848972082,practice approach ATC advised them of,0.0014923635171726346,0.35,0.2818181818181818
