row_id,narrative_snippet,distilbert_ACTOR_ans,distilbert_ACTOR_conf,distilbert_SYSTEM_ans,distilbert_SYSTEM_conf,distilbert_PHASE_ans,distilbert_PHASE_conf,distilbert_TRIGGER_ans,distilbert_TRIGGER_conf,distilbert_OUTCOME_ans,distilbert_OUTCOME_conf,roberta_ACTOR_ans,roberta_ACTOR_conf,roberta_SYSTEM_ans,roberta_SYSTEM_conf,roberta_PHASE_ans,roberta_PHASE_conf,roberta_TRIGGER_ans,roberta_TRIGGER_conf,roberta_OUTCOME_ans,roberta_OUTCOME_conf,aerobert_ACTOR_ans,aerobert_ACTOR_conf,aerobert_SYSTEM_ans,aerobert_SYSTEM_conf,aerobert_PHASE_ans,aerobert_PHASE_conf,aerobert_TRIGGER_ans,aerobert_TRIGGER_conf,aerobert_OUTCOME_ans,aerobert_OUTCOME_conf,agreement_roberta_distilbert_f1,agreement_roberta_aerobert_f1
32,Air carrier First Officer reported an NMAC as aler,The Captain,0.9171616435050964,a helicopter,0.39555624127388,NMAC,0.0940074473619461,an NMAC,0.14147208631038666,continue the approach,0.358704537153244,Captain,0.0068945805542171,NMAC,0.008585745468735695,go-around,0.18526360392570496,conflicting traffic,0.1157231554389,The Captain; who was the pilot flying; decided to continue the approach,0.11044667661190033,go,0.0006653247983194888,conflicting traffic if they executed a go,0.000681104080285877,conflicting traffic if they executed a go,0.0006627369439229369,go,0.0006655902252532542,on approach,0.0006737727089785039,0.2727272727272727,0.03636363636363636
33,Pilot reported an NMAC in cruise with an aircraft ,Pilot,0.5853503122925758,NMAC,0.7677333013853058,cruise,0.9905108213424683,an NMAC,0.14231032133102417,Pilot took evasive action to avoid the other aircraft,0.11525703221559525,aircraft,0.0002693762071430683,NMAC,0.0022085265372879803,cruise,0.5914934277534485,an aircraft that was making 360 degree turns in their vicinity,0.19208426773548126,an NMAC in cruise,0.06383778899908066,that was,0.0016895676963031292,that was,0.001816264702938497,that was,0.0017796201864257455,that was,0.0017746565863490105,that was,0.0018833493813872337,0.4,0.06666666666666668
34,Air carrier Captain reported an NMAC with a UAS wh,Air carrier Captain,0.9231938719749451,UAS,0.4179140031337738,final approach,0.8086597919464111,No evasive action was taken and the flight continued without further incident,0.31542664766311646,No evasive action was taken and the flight continued without further incident,0.21440351009368896,a UAS,0.0008098698453977704,UAS,0.12338395818369463,final approach,0.7940980195999146,No evasive action was taken,0.07354352623224258,the flight continued without further incident,0.2794337570667267,UAS,0.006145821651443839,UAS,0.004177742172032595,UAS,0.00426440080627799,UAS,0.0043696153443306684,UAS,0.004535004263743758,0.65,0.4
35,Air carrier pilot reported GPS interference and th,Air carrier pilot,0.7949415445327759,GPS interference and then recovery between IMB and KU75M,0.26748570799827576,recovery between IMB and KU75M,0.27882009744644165,GPS interference,0.9054100513458252,recovery,0.6626203060150146,KU75M.,1.5884572590607604e-07,GPS,0.5170065760612488,recovery,0.6160192489624023,GPS interference,0.5635250806808472,recovery,0.795582115650177,KU75M,0.007837675279006362,GPS interference,0.004333307035267353,KU75M,0.00802629697136581,GPS interference and then recovery between,0.004311678931117058,GPS interference,0.004277490079402924,0.5066666666666666,0.4333333333333333
36,General aviation pilot reported experiencing a NMA,General aviation pilot,0.9199090003967285,NMAC,0.7613021703436971,traffic pattern,0.5799696445465088,a NMAC,0.44143787026405334,avoid a conflict,0.06802655011415482,other aircraft,7.965355325723067e-05,NMAC,0.0009194065733026946,traffic pattern,0.2299327552318573,NMAC in the traffic pattern,0.19099324941635132,The other aircraft took evasive action,0.0358654223382473,evasive action to avoid a,0.004380859201774001,General aviation,0.0027852989733219147,evasive action to avoid a,0.004391005262732506,evasive action to avoid a,0.004403889179229736,evasive action to avoid a,0.004509895574301481,0.48,0.08888888888888889
37,ZLA Center Controller reported a ground stop at LA,ZLA Center Controller,0.8346337676048279,understaffing,0.23666087118908763,ground stop,0.5285820364952087,high workload,0.40543147921562195,unmanageable and unworkable,0.42120227217674255,ZLA Center Controller reported a ground stop at LAS Airport,1.8562489856321918e-07,ground stop at LAS Airport,0.0002698920725379139,ground,3.7463174521690235e-05,understaffing,0.19315098226070404,a ground stop at LAS Airport,0.03326382488012314,unmanageable,0.004300587985198945,unmanageable,0.004173839988652617,unmanageable and unworkable,0.0037605180987156928,unmanageable,0.004289978824090213,unmanageable,0.004222717194352299,0.2333333333333333,0.0
38,Light aircraft reported that after takeoff from TC,Light aircraft,0.32859358191490173,broke off their landing attempt,0.5440847873687744,takeoff from TCY he became aware another aircraft broke off their landing attempt,0.2535299062728882,broke off their landing attempt because of the conflict with his departure,0.16489441692829132,broke off their landing attempt,0.3764885365962982,Light,1.1907605767191853e-05,another aircraft,0.0004941588849760592,landing,0.17771121859550476,conflict with his departure,0.29033970832824707,another aircraft broke off their landing attempt,0.05467476323246956,their landing attempt,0.002212518360465765,their landing attempt,0.002259661443531513,their landing attempt because of,0.0023266973439604044,their landing attempt because of,0.002207834040746093,their landing attempt,0.0023212158121168613,0.4352380952380953,0.18666666666666668
39,A TRACON Controller reported they misread the flig,departing aircraft,0.07921507954597473,flight strip,0.32515034079551697,below the minimum vectoring altitude,0.4919203519821167,the aircraft flying below the minimum vectoring altitude,0.20125269889831543,the aircraft flying below the minimum vectoring altitude,0.30173447728157043,aircraft resulting in the aircraft flying below the minimum vectoring altitude.,5.519257229025243e-08,misread the flight strip of a departing aircraft,0.011489168740808964,below the minimum vectoring altitude,0.10265602171421051,misread the flight strip of a departing aircraft,0.16846223175525665,flying below the minimum vectoring altitude,0.3704560399055481,misread the flight strip of,0.0037258538650348783,misread the flight strip of,0.0037830903893336654,misread the flight strip of,0.0019973847083747387,misread the flight strip of,0.003760645864531398,misread the flight strip of,0.0039580874145030975,0.5515151515151515,0.32
40,Air carrier flight crew reported receiving a low a,Air carrier flight crew,0.6752076148986816,SFO Tower,0.11880700290203094,descent,0.9432013034820557,low altitude alert,0.08081424981355667,high rate of descent,0.3130149245262146,SFO Tower,7.191255235738936e-07,TCAS RA,0.00975005328655243,descent,0.3211665451526642,high rate of descent,0.048174694180488586,high rate of descent,0.07741529494524002,low altitude alert from SFO Tower while responding to,0.000954233983065933,low altitude alert from SFO Tower while responding to,0.0009212802397087216,low altitude alert from SFO Tower while responding to,0.0009518289589323103,low altitude alert from SFO Tower while responding to,0.0009579990874044597,low altitude alert from SFO Tower while responding to,0.0009640147909522057,0.4,0.07272727272727272
41,Air carrier flight crew reported responding to a T,Air carrier flight crew,0.20859286189079285,TCAS RA,0.25044775009155273,final approach to PHL,0.31371015310287476,a helicopter flying beneath them,0.24242733418941498,final approach to PHL that was caused by a helicopter flying beneath them,0.310801237821579,helicopter,0.048657264560461044,TCAS RA,0.1153171956539154,final approach,0.41524896025657654,a helicopter flying beneath them,0.5656408667564392,a helicopter flying beneath them,0.11025011539459229,final approach,0.0015150140970945358,final approach,0.001593390479683876,final approach,0.001676574582234025,final approach,0.0015145493671298027,final approach,0.0016366868512704968,0.6333333333333333,0.2
42,Air carrier Captain reported the unshielded ramp l,Air carrier Captain,0.9416599273681641,ramp,0.5262910723686218,final approach,0.7867879867553711,unshielded ramp lighting,0.37209269404411316,final approach,0.5817927122116089,air traffic and affect being able to see other aircraft at night.,3.285360605786991e-07,unshielded ramp lighting,0.00029858050584152807,final approach,0.07841580361127853,unshielded ramp lighting,0.20984384417533875,final approach,0.13833163678646088,unshielded lighting can create an illusion of,0.0014035768108442426,unshielded lighting can create an illusion of,0.0013525416725315154,unshielded lighting can create an illusion of,0.0013469367986544967,unshielded lighting can create an illusion of,0.001402107416652143,unshielded lighting can create an illusion of,0.0013149332953616977,0.7266666666666667,0.17777777777777776
43,Flight Instructor reported an NMAC during departur,Flight Instructor,0.9499522961486946,NMAC,0.8389298156835139,Flight Instructor,0.31478700041770935,an NMAC,0.2558007538318634,an NMAC during departure after the tower had closed for the day,0.16319112479686737,NMAC during departure after the tower had closed for the day.,3.5866426628672343e-07,NMAC,0.19965260275057517,departure,0.6462266445159912,after the tower had closed for the day,0.1433635652065277,an NMAC,0.20478932559490204,NMAC during departure after the tower had closed for,0.00852593732997775,NMAC during departure after the tower had closed for,0.008864032570272684,NMAC during departure after the tower had closed for,0.008777208626270294,NMAC during departure after the tower had closed for,0.00863094162195921,NMAC during departure after the tower had closed for,0.008804766461253166,0.24,0.46442577030812326
44,ZSE Controller reported aircraft descended below p,ZSE Controller,0.44430336356163025,aircraft descended below published altitude resulting in a low altitude alert and a CFTT,0.2153780609369278,CFTT,0.47167909145355225,a CFTT event,0.27118977904319763,low altitude alert and a CFTT event,0.1824968308210373,CFTT event.,8.223867808965224e-08,aircraft descended below published altitude,0.0010158071527257562,descended below published altitude,0.47366392612457275,CFTT event,0.20631520450115204,low altitude alert and a CFTT event,0.2836131751537323,ZSE Controller reported aircraft descended below published altitude resulting in a,0.006650080438703299,ZSE Controller reported aircraft descended below published altitude resulting in a,0.007058124057948589,ZSE Controller reported aircraft descended below published altitude resulting in a,0.007094925036653876,ZSE Controller reported aircraft descended below published altitude resulting in a,0.0069211320951581,ZSE Controller reported aircraft descended below published altitude resulting in a,0.007109386380761862,0.5176470588235295,0.27261904761904765
45,Air carrier First Officer reported receiving a GPW,Air carrier First Officer,0.8000975847244263,GPWS,0.29273921251296997,GPWS,0.8390264539048076,a GPWS terrain alert,0.31413188576698303,GPWS terrain alert,0.16624341905117035,MMMM/MLM airport.,3.5247245477876277e-07,GPWS,0.000943693765293574,approach,0.004245770163834095,GPWS terrain alert,0.0580536425113678,GPWS terrain alert on approach to MMMM/MLM airport,0.00029772892594337463,MLM airport,0.006794447544962168,MLM airport,0.0070052496157586575,MLM airport,0.007176789455115795,MLM airport,0.006822404218837619,MLM airport,0.007031869143247604,0.509090909090909,0.13999999999999999
46,Air Taxi First Officer reported landing safely aft,Air Taxi First Officer,0.8662080764770508,Air Taxi First Officer reported landing safely after receiving a low altitude alert,0.18162792921066284,low altitude alert,0.21531255543231964,low altitude alert,0.47540104389190674,short final,0.32752084732055664,short final to BOS airport.,1.338292804575758e-06,Air Taxi,8.76185640663607e-06,short final,0.38986605405807495,low altitude alert,0.12105511873960495,landing safely,0.186231330037117,BOS airport,0.006814699154347181,BOS airport,0.007174663711339235,BOS airport,0.007198916748166084,BOS airport,0.006852414924651384,BOS airport,0.007015928393229842,0.2571428571428571,0.1142857142857143
47,Air carrier Captain reported receiving a low altit,Air carrier Captain,0.8428085446357727,low altitude alert from ATC on approach to LAX,0.0736316442489624,low altitude alert from ATC on approach to LAX,0.463218092918396,low altitude alert,0.3721064031124115,low altitude alert from ATC on approach to LAX,0.14701929688453674,ATC,1.7179509541165316e-05,miscommunication with ATC,0.13415365875698626,approach,0.0815332904458046,miscommunication with ATC,0.3698643147945404,low altitude alert from ATC on approach to LAX,0.013344403356313705,miscommunication,0.008790696505457163,miscommunication,0.006699134828522801,miscommunication,0.006754371104761958,miscommunication,0.008793180109933019,miscommunication,0.004530520178377628,0.2733333333333333,0.2
48,TRACON Controller reported aircraft descended belo,TRACON Controller,0.5942380428314209,aircraft descended below assigned altitude on approach,0.09825728088617325,approach,0.47401663661003113,a CFTT event,0.22555819153785706,low altitude alert and a CFTT event,0.1783352643251419,CFTT event.,1.7225637805040606e-07,aircraft descended below assigned altitude,0.004862780682742596,approach,0.32285621762275696,aircraft descended below assigned altitude,0.14739595353603363,low altitude alert and a CFTT event,0.30396294593811035,altitude on approach resulted in a low altitude alert and a CFTT,0.002804060000926256,low altitude alert and a CFTT,0.002777425106614828,low altitude alert and a CFTT,0.0028168216813355684,altitude on approach resulted in a low altitude alert and a CFTT,0.0027411868795752525,altitude on approach resulted in a low altitude alert and a CFTT,0.0027522684540599585,0.5666666666666667,0.225
49,C-172 Flight Instructor reported a near mid air co,C-172 Flight Instructor,0.8735421716119163,departing aircraft,0.276004433631897,mid air collision with departing aircraft while entering traffic pattern,0.2496415376663208,a near mid air collision,0.33432480692863464,near mid air collision with departing aircraft while entering traffic pattern,0.19323989748954773,.,7.192117834620149e-08,C-172,0.0016078861663118005,traffic pattern,0.41315409541130066,near mid air collision with departing aircraft,0.28195151686668396,near mid air collision,0.22831013798713684,mid air collision with,0.00490929139778018,mid air collision with,0.004947842098772526,mid air collision with,0.004912910051643848,mid air collision with,0.005014712922275066,mid air collision with,0.004859833512455225,0.31878787878787873,0.29545454545454547
50,Part 107 UAS pilot reported a brief entry into con,Part 107 UAS pilot,0.4888989329338074,The pilot immediately exited the controlled airspace,0.09435221552848816,exited the controlled airspace,0.1310218721628189,The pilot immediately exited the controlled airspace,0.1794474571943283,exited the controlled airspace,0.16948480904102325,UAS pilot,3.897900023730472e-05,Part 107,0.0016308362828567624,Part 107,0.1147095188498497,a brief entry into controlled airspace without authorization,0.054504238069057465,The pilot immediately exited the controlled airspace,0.20558848977088928,UAS,0.0056983367539942265,. The pilot immediately exited the controlled,0.0032113445922732353,. The pilot immediately exited the controlled,0.0032191723585128784,UAS,0.005763206398114562,UAS pilot reported a brief entry into controlled airspace,0.003159963758662343,0.35,0.22564102564102564
51,Cessna 210 pilot reported a near midair collision ,Cessna 210 pilot,0.8791494557372062,jet aircraft,0.4739648699760437,midair,0.759282088605687,near midair collision,0.4701719284057617,prevent a conflict,0.3193615972995758,jet aircraft on approach at intersecting runways.,2.583769855846185e-07,Cessna 210,0.04370613543142099,midair,0.6240014433860779,near midair collision with a jet aircraft,0.14086419343948364,near midair collision,0.053273849189281464,-around to prevent a,0.0017995513044297695,-around to prevent a,0.0017887428402900696,-around to prevent a,0.0017866919515654445,-around to prevent a,0.001822546822950244,-around to prevent a,0.0017920552054420114,0.3333333333333333,0.0
52,Air carrier pilot reported that on final approach ,Air carrier pilot,0.7506325244903564,vehicle,0.6660072803497314,final approach,0.26860249042510986,turn-off lights,0.37480592727661133,create an illusion,0.2901058793067932,a vehicle or plane,2.474323264323175e-05,plane,3.939200541935861e-05,final approach,0.22459112107753754,the turn-off lights,0.24415595829486847,final approach to JAX,0.10026865452528,like there is a,0.0021196813322603703,like there is a,0.002169280778616667,like there is a,0.0021890720818191767,like there is a,0.0021637286990880966,like there is a,0.0021728381980210543,0.4,0.0
53,A Flight Instructor reported two NMAC's while on d,NMAC,0.3889343738555908,NMAC's,0.4717104136943817,downwind in the Tower VFR pattern,0.3502139747142792,NMAC's,0.09209039807319641,two NMAC's,0.14874400198459625,downwind in the Tower VFR pattern.,2.6907102324003063e-08,NMAC's,0.14319659769535065,VFR,0.30700039863586426,two NMAC's,0.1527862697839737,two NMAC's,0.06418676674365997,VFR,0.007358628557994962,VFR,0.007602686760947108,VFR,0.0071330079808831215,VFR,0.007461773697286844,VFR,0.007241721730679274,0.6,0.2666666666666667
54,Air carrier flight crew reported the TRACON Contro,TRACON Controller,0.4697607159614563,TRACON,0.231551144272089,low altitude alert,0.20227813720703125,low altitude alert,0.41040903329849243,low altitude alert,0.7421219348907471,TRACON Controller,1.6588046491960995e-06,TRACON Controller,0.19262918706226628,low altitude,0.1030610129237175,TRACON Controller descended them to an altitude below the minimum vectoring altitude,0.07783690094947815,descended them to an altitude below the minimum vectoring altitude,0.07755832374095917,them to an altitude below the,0.002157279523089528,them to an altitude below the,0.002135897520929575,them to an altitude below the,0.0022063557989895344,them to an altitude below the,0.0021772142499685287,them to an altitude below the,0.0021700533106923103,0.5604662004662004,0.31428571428571433
55,Light aircraft pilot reported an NMAC on approach ,Light aircraft pilot,0.852367103099823,NMAC,0.9337726337835193,NMAC,0.9364291497913655,an NMAC,0.43560370802879333,NMAC,0.3537278473377228,D57 airport.,1.71991672459626e-07,NMAC,0.004992939089788706,Light,0.3233899176120758,NMAC,0.10294251143932343,NMAC,0.03157231584191322,Light aircraft pilot reported an NMAC on approach to D57 airport,0.007237540557980537,Light aircraft pilot reported an NMAC on approach to,0.007272691931575537,Light aircraft pilot reported an NMAC on approach to D57 airport,0.007134228479117155,Light aircraft pilot reported an NMAC on approach to,0.0072098891250789165,Light aircraft pilot reported an NMAC on approach to,0.007625815458595753,0.6,0.2363636363636364
56,Flight Instructor reported during landing roll-out,Flight Instructor,0.9649450205033645,small jet,0.19056476652622223,landing roll-out,0.784271776676178,overflying the instructor's aircraft,0.3315342366695404,overflying the instructor's aircraft,0.23924636840820312,small jet did a go-around overflying the instructor's aircraft.,2.2570637270291627e-07,small jet did a go-around overflying the instructor's aircraft,0.0006743118283338845,landing roll-out,0.7840088605880737,a small jet,0.27943122386932373,a small jet did a go-around overflying the instructor's aircraft,0.22452792525291443,around overflying,0.006874058861285448,overflying,0.006956504425033927,overflying,0.007023971760645509,around overflying,0.006913675693795085,overflying,0.009228967363014817,0.40888888888888886,0.14444444444444443
57,Low wing aircraft Flight Instructor reported takin,Low wing aircraft Flight Instructor,0.744526207447052,Low wing aircraft,0.35205498337745667,Low wing,0.7276768684387207,NMAC event,0.538346529006958,NMAC event,0.4260057508945465,.,5.213568954332004e-08,Low wing aircraft,0.265308141708374,Low wing,0.8020470142364502,NMAC event,0.13860075175762177,NMAC event,0.35786640644073486,wing aircraft Flight,0.0034776320680975914,wing aircraft,0.0034539790358394384,Low wing aircraft Flight,0.00345455389469862,wing aircraft Flight,0.003433103673160076,wing aircraft Flight,0.0035079699009656906,0.8,0.29333333333333333
58,Air carrier Captain reported receiving a low altit,Air carrier Captain,0.8882461190223694,Air carrier Captain reported receiving a low altitude warning from ATC,0.0581648088991642,landing,0.6227718591690063,unstable approach in visual conditions,0.32621023058891296,a landing,0.5417917370796204,pilot performed a go-around and returned for a landing.,5.580406650551595e-06,ATC,0.0032003390515455976,landing,0.13366109132766724,low altitude warning from ATC during an unstable approach in visual conditions,0.12763254344463348,returned for a landing,0.2575209438800812,for a landing,0.0018031150102615356,for a,0.0017901709070429206,for a,0.0018090895609930158,for a landing,0.001796900061890483,for a,0.0017672509420663118,0.4613636363636363,0.18888888888888888
59,Flight instructor reported while in the pattern an,flight instructor,0.5180438458919525,spacing,0.6773094534873962,spacing,0.672050416469574,collision with the other aircraft,0.14671723544597626,taking evasive action to avoid a collision with the other aircraft,0.22145195305347443,flight instructor taking evasive action to avoid a collision with the other aircraft.,1.1680646139211603e-06,another aircraft was not allowing for spacing,0.13780754804611206,pattern,0.7028157711029053,another aircraft was not allowing for spacing,0.7481225728988647,the flight instructor taking evasive action to avoid a collision with the other aircraft,0.1255997270345688,for spacing,0.003040128853172064,for spacing,0.0030988610815256834,for spacing,0.00311297329608351,for spacing,0.00294979615136981,for spacing,0.0031086914241313934,0.3279020979020979,0.17777777777777778
60,ZDV Controller reported that due to lack of suffic,ZDV,0.3441321821883321,ZDV,0.11680546402931213,below the Minimum IFR Altitude,0.13146421313285828,lack of sufficient radio coverage,0.7068247199058533,unable to issue a higher altitude,0.1073879525065422,radio,0.0001358891313429922,aircraft which had been assigned an altitude below the Minimum IFR Altitude,0.017668362706899643,Minimum IFR,0.04751400277018547,lack of sufficient radio coverage,0.10049381852149963,higher altitude,0.015993108972907066,ZDV Controller reported that due to lack of,0.0020118277752771974,ZDV Controller reported that due to lack of,0.0019547477131709456,ZDV Controller reported that due to lack of,0.0019852088880725205,ZDV Controller reported that due to lack of,0.0019747979240491986,ZDV Controller reported that due to lack of,0.0020268813241273165,0.44761904761904764,0.06153846153846154
61,Air taxi Captain reported a traffic conflict with ,Air taxi Captain,0.9328381419181824,air taxi,0.33169254660606384,final approach,0.8631901144981384,traffic conflict,0.4745939075946808,final approach,0.6572415828704834,Air taxi Captain,1.9300334315630607e-05,takeoff,0.0003669222933240235,final approach,0.11714202165603638,the aircraft on the runway rejected their takeoff,0.09544804692268372,the aircraft on the runway rejected their takeoff,0.2680753469467163,final approach; when the aircraft on the,0.0012478280114009976,final approach; when the aircraft on the,0.001242757891304791,final approach; when the aircraft on the,0.0012648041592910886,go,0.0012703101383522153,final approach,0.0012859134003520012,0.4,0.1142857142857143
62,Air carrier pilot reported while on final approach,Air carrier pilot,0.8930670022964478,helicopter,0.6820810093777254,final approach,0.393917977809906,collision with the helicopter,0.38644030690193176,reduce the descent rate,0.4414834976196289,helicopter,0.042320007385569625,helicopter,0.045982600131537765,final approach,0.5140701532363892,a helicopter,0.06229999661445618,final approach,0.19935913383960724,final approach ATC advised them of,0.0013665511505678296,final approach ATC advised them of,0.001368898549117148,final approach ATC advised them of,0.001428299699909985,final approach ATC advised them of,0.0013837225269526243,final approach ATC advised them of,0.0013725532917305827,0.5,0.2
63,A Center Controller working combined sectors repor,Center Controller,0.7889796495437622,safe operation of their sector,0.06445351243019104,end of the day,0.13458524644374847,they became distracted,0.2628902494907379,end of the day,0.26763537526130676,OPM,0.00010282881703460589,distracted,4.740158601634903e-06,the end of the day.,2.2645417629973963e-06,distracted,0.05104437842965126,end of the day,0.05341082811355591,could not focus on the safe operation of their sector after being notified of,0.0009063068428076804,could not focus on the safe operation of their sector after being notified of,0.0009214628371410072,could not focus on the safe operation of their sector after being notified of,0.0009221673244610429,could not focus on the safe operation of their sector after being notified of,0.0008934431825764477,could not focus on,0.0009236785117536783,0.5,0.025
